<?xml version = "1.0" encoding="UTF-8" ?>
<!DOCTYPE Planning  SYSTEM 'programmePedago.dtd'>
<Planning >
	<Semaine number="41">
		<Jour number="1" >
			<Task time="7">CA20</Task>
		</Jour>
		<Jour number="2">
			<Task time="1">VEIL01</Task>
			<Task time="6">CA20</Task>
		</Jour>
		<Jour number="3">
       		<Task time="3">GB01</Task>
       		<Task time="4">CA20</Task>
		</Jour>
		<Jour number="4">
			<Task time="7">MAINTENANT</Task>
		</Jour>
		<Jour number="5">
			<Task time="7">INS PRO</Task>
		</Jour>
	</Semaine>
	<Semaine number="42">
		<Jour number="1" >
			<Task time="7">CA20</Task>
		</Jour>
		<Jour number="2">
			<Task time="7">CSS15</Task>
		</Jour>
		<Jour number="3">
			<Task time="3">GB01</Task>
       		<Task time="4">CSS15</Task>
		</Jour>
		<Jour number="4">
			<Task time="4">CSS15</Task>
			<Task time="3">CERT01</Task>
		</Jour>
		<Jour number="5">
			<Task time="3">INS PRO</Task>
			<Task time="1">Gwenn Houedry</Task>
			<Task time="3">INS PRO</Task>
		</Jour>
	</Semaine>
	<Semaine number="43">
		<Jour number="1" >
			<Task time="3">SQL20</Task>
			<Task time="4">SQL30</Task>
		</Jour>
		<Jour number="2">
			<Task time="3">SQL20</Task>
			<Task time="4">SQL30</Task>
		</Jour>
		<Jour number="3">
       		<Task time="3">GB01</Task>
       		<Task time="4">OPQUAST</Task>
		</Jour>
		<Jour number="4">
			<Task time="4">CA20</Task>
			<Task time="3">CERT03</Task>
		</Jour>
		<Jour number="5">
			<Task time="3">INS PRO</Task>
			<Task time="1">Christophe DJAFAR</Task>
			<Task time="3">INS PRO</Task>
		</Jour>
	</Semaine>
</Planning>