<?xml version = "1.0" encoding="UTF-8" ?>
<!DOCTYPE Planning  SYSTEM '../programmePedago.dtd'>
<?xml-stylesheet href="../css/style.css" type="text/css" ?>
<Planning >
	
	
	<Semaine number="48">
		<Jour number="1"><Task time="7">OPQUAST </Task></Jour>
		<Jour number="2"><Task time="7">FORK </Task></Jour>
		<Jour number="3"><Task time="7">FORK </Task></Jour>
		<Jour number="4">
			<Task time="1">SPRINT#02 </Task>
			<Task time="6">FORK </Task>
		</Jour>
		<Jour number="5"><Task time="7">INS PRO </Task></Jour>
	</Semaine>
	<Semaine number="49">
		<Jour number="1"><Task time="7">TDD03 </Task></Jour>
		<Jour number="2"><Task time="7">TDD03 </Task></Jour>
		<Jour number="3"><Task time="7">CA20 </Task></Jour>
		<Jour number="4"><Task time="7">CA20 </Task></Jour>
		<Jour number="5"><Task time="7">CapGemini - Secure Coding </Task></Jour>
	</Semaine>

	<Semaine number="50">
		<Jour number="1"><Task time="7">FORK </Task></Jour>
		<Jour number="2"><Task time="7">FORK </Task></Jour>
		<Jour number="3"><Task time="1">SPRINT#03 </Task>
			<Task time="6">FORK </Task></Jour>
		<Jour number="4"><Task time="7">CERT05 </Task></Jour>
		<Jour number="5">
				<Task time="3">INS PRO</Task>
				<Task time="4">French Tech</Task>
		</Jour>
	</Semaine>
	<Semaine number="51">
		<Jour number="1"><Task time="3">Visite CapGemini</Task><Task time="4">CA20</Task></Jour>
		<Jour number="2"><Task time="7">CA20</Task></Jour>
		<Jour number="3"><Task time="7">CA20</Task></Jour>
		<Jour number="4"><Task time="7">Certif OPQUAST</Task></Jour>
		<Jour number="5"><Task time="7">INS PRO </Task></Jour>
	</Semaine>
	<Semaine number="52">
		<Jour number="1" ferie="true">
			<Task time="7"> </Task>
		</Jour>
		<Jour number="2" ferie="true">
			<Task time="7"> </Task>
		</Jour>
		<Jour number="3" ferie="true">
			<Task time="7"> </Task>
		</Jour>
		<Jour number="4" ferie="true">
			<Task time="7"> </Task>
		</Jour>
		<Jour number="5" ferie="true">
			<Task time="7"></Task>
		</Jour>
	</Semaine>
	<Semaine number="1">
		<Jour number="1" ferie="true">
			<Task time="7"> </Task>
		</Jour>
		<Jour number="2">
			<Task time="7">CA20</Task>
		</Jour>
		<Jour number="3">
			<Task time="1">SPRINT#04 </Task>
			<Task time="6">CA20 </Task>
		</Jour>
		<Jour number="4">
			<Task time="7">CA20</Task>
		</Jour>
		<Jour number="5">
			<Task time="7">INS PRO </Task>
		</Jour>
	</Semaine>
	<Semaine number="2">
		<Jour number="1">
			<Task time="7">CA20 </Task>
		</Jour>
		<Jour number="2">
			<Task time="7">CA40 </Task>
		</Jour>
		<Jour number="3">
			<Task time="7">SimulationEntretien </Task>
		</Jour>
		<Jour number="4">
			<Task time="7">CA20 </Task>
		</Jour>
		<Jour number="5">
			<Task time="7">INS PRO </Task>
		</Jour>
	</Semaine>
	<Semaine number="3">
		<Jour number="1">
			<Task time="7">PREPA CERTIF</Task>
		</Jour>
		<Jour number="2">
			<Task time="7">CERTIF</Task>
		</Jour>
		<Jour number="3">
			<Task time="7">CERTIF</Task>
		</Jour>
		<Jour number="4">
			<Task time="7">INS PRO</Task>
		</Jour>
		<Jour number="5">
			<Task time="7">SimulationEntretien</Task>
		</Jour>
	</Semaine>
	<Semaine number="4">
		<Jour number="1">
			<Task time="7">INS PRO</Task>
		</Jour>
		<Jour number="2" ferie="true">
			<Task time="7"></Task>
		</Jour>
		<Jour number="3" ferie="true">
			<Task time="7"></Task>
		</Jour>
		<Jour number="4" ferie="true">
			<Task time="7"></Task>
		</Jour>
		<Jour number="5" ferie="true">
			<Task time="7"></Task>
		</Jour>
	</Semaine>
</Planning>
