<?xml version = "1.0" encoding="UTF-8" ?>
<!DOCTYPE Planning  SYSTEM 'programmePedago.dtd'>
<Planning >
	<Semaine number="27">
		<Jour number="1" >
			<Task time="7">PHP11</Task>
		</Jour>
		<Jour number="2">
			<Task time="1">VEIL01</Task>
			<Task time="1">PHP99</Task>
			<Task time="5">WP99</Task>
		</Jour>
		<Jour number="3">
			<Task time="6">ALGO</Task>
			<Task time="1">PHP99</Task>
		</Jour>
		<Jour number="4">
			<Task time="4">HTML04</Task>
			<Task time="3">LIBRE </Task>
		</Jour>
		<Jour number="5">
			<Task time="3">INS PRO</Task>
			<Task time="1">Intervention HTMY</Task>
			<Task time="3">INS PRO</Task>
		</Jour>
	</Semaine>
	<Semaine number="28">
		<Jour number="1" ferie="true">
			<Task time="7">Work@Home</Task>
		</Jour>
		<Jour number="2">
			<Task time="1">VEIL01</Task>
			<Task time="6">CA00</Task>
		</Jour>
		<Jour number="3">
			<Task time="7">WP99</Task>
		</Jour>
		<Jour number="4"><Task time="7">INS PRO</Task></Jour>
		<Jour number="5" ferie='true'><Task time="7">FERIE</Task></Jour>
	</Semaine>
	<Semaine number="29">
		<Jour number="1" >
			<Task time="1">CUL12</Task>
			<Task time="4">ALGO</Task>
			<Task time="2">PHP11</Task>
		</Jour>
		<Jour number="2">
			<Task time="1">VEIL01</Task>
			<Task time="6">WP99</Task>
			
		</Jour>
		<Jour number="3">
			<Task time="1">CUL13</Task>
			<Task time="3">PHP11</Task>
			<Task time="3">JS10</Task>
		</Jour>
		<Jour number="4">
			<Task time="1">CUL10</Task>
			<Task time="1">CUL11</Task>
			<Task time="5">WP99</Task>
		</Jour>
		<Jour number="5">
			<Task time="3">Intervention DOLMEN</Task>
			<Task time="4">INS PRO</Task>
		</Jour>
	</Semaine>
	<Semaine number="30">
		<Jour number="1" ><Task time="7"></Task></Jour>
		<Jour number="2">
			<Task time="1">VEIL01</Task>
			<Task time="6"></Task>
		</Jour>
		<Jour number="3"><Task time="7"></Task></Jour>
		<Jour number="4"><Task time="7"></Task></Jour>
		<Jour number="5">
			<Task time="3">Intervention Big Me Up</Task>
			<Task time="4">INS PRO</Task>
		</Jour>
	</Semaine>
</Planning>
