<?xml version = "1.0" encoding="UTF-8" ?>
<!DOCTYPE root
  SYSTEM 'programmePedago.dtd'>
<root>
	<Programme formation="Tronc Commun">
		<Module group="Tronc_Commun" language="PHP">
			<Objectif>Développer dans des langages web</Objectif>
			<Sequence>
				<Objectif>Développer un site web en PHP</Objectif>
				<Activite>
					<Objectif>Le Projet PHP</Objectif>
					<Code>WEB-PHP-06</Code>
					<Description>
						https://github.com/ErwannFace/php_projet
					</Description>
				</Activite>
				<Activite>
					<Objectif>Simplonsmus</Objectif>
					<Code>WEB-PHP-07</Code>
					<Description>
						Dans le cadre de simplonsmus, les apprenants vont réaliser des projets ensemble. 
						1) Le site de la promo
						2) Le site du hackathon
						3) Le site de bowling
						4) Une analyse du besoin d'ASRAC
						https://github.com/ErwannFace/projects
					</Description>
				</Activite>
			</Sequence>
		</Module>
		<Module group="Tronc_Commun" language="N/A">
			<Objectif>Compréhender les besoins nécessaires pour un chef de projet</Objectif>
			<Sequence>
				<Objectif>Travailler pour un client</Objectif>
				<Activite>
					<Objectif>Projet Profesionel</Objectif>
					<Code>GES-04-01</Code>
					<Description>
						Des vrais clients réalisent une demande à FACE pour implémenter leurs sites web. 
					</Description>
				</Activite>
			</Sequence>
		</Module>
	</Programme>
</root>