<?xml version = "1.0" encoding="UTF-8" ?>
<!DOCTYPE Planning  SYSTEM 'programmePedago.dtd'>
<Planning >
	<!-- Semaine number="41">
		<Jour number="1" >
			<Task time="7">CA20</Task>
		</Jour>
		<Jour number="2">
			<Task time="1">VEIL01</Task>
			<Task time="6">CA20</Task>
		</Jour>
		<Jour number="3">
       		<Task time="3">GB01</Task>
       		<Task time="4">CA20</Task>
		</Jour>
		<Jour number="4">
			<Task time="7">MAINTENANT</Task>
		</Jour>
		<Jour number="5">
			<Task time="7">INS PRO</Task>
		</Jour>
	</Semaine>
	<Semaine number="42">
		<Jour number="1" >
			<Task time="7">CA20</Task>
		</Jour>
		<Jour number="2">
			<Task time="7">RN10</Task>
		</Jour>
		<Jour number="3">
       		<Task time="3">GB01</Task>
       		<Task time="4">RN10</Task>
		</Jour>
		<Jour number="4">
			<Task time="4">RN10</Task>
			<Task time="3">CERT01</Task>
		</Jour>
		<Jour number="5">
			<Task time="3">INS PRO</Task>
			<Task time="1">Gwenn Houedry</Task>
			<Task time="3">INS PRO</Task>
		</Jour>
	</Semaine>
	<Semaine number="43">
		<Jour number="1" >
			<Task time="3">SQL20</Task>
			<Task time="4">SQL30</Task>
		</Jour>
		<Jour number="2">
			<Task time="3">SQL20</Task>
			<Task time="4">SQL30</Task>
		</Jour>
		<Jour number="3">
       		<Task time="3">GB01</Task>
       		<Task time="4">OPQUAST</Task>
		</Jour>
		<Jour number="4">
			<Task time="4">CA20</Task>
			<Task time="3">CERT03</Task>
		</Jour>
		<Jour number="5">
			<Task time="3">INS PRO</Task>
			<Task time="1">Christophe DJAFAR</Task>
			<Task time="3">INS PRO</Task>
		</Jour>
	</Semaine>
	<Semaine number="44">
		<Jour number="1" >
			<Task time="7">CA20</Task>
		</Jour>
		<Jour number="2">
			<Task time="7">INS PRO</Task>
		</Jour>
		<Jour number="3" ferie="true">
       		<Task time="7"> </Task>
		</Jour>
		<Jour number="4">
			<Task time="7">CA20</Task>
		</Jour>
		<Jour number="5">
			<Task time="7">CA20</Task>
		</Jour>
	</Semaine>
	<Semaine number="45">
		<Jour number="1" >
			<Task time="7">RN10</Task>
		</Jour>
		<Jour number="2">
			<Task time="7">RN10</Task>
		</Jour>
		<Jour number="3">
       		<Task time="7">RN10</Task>
		</Jour>
		<Jour number="4">
			<Task time="3">CERT04</Task>
			<Task time="4">CODINGDOJO</Task>
		</Jour>
		</Jour>
		<Jour number="5">
			<Task time="7">Mathieu KERJOUAN</Task>
		</Jour>
	</Semaine>
	<Semaine number="46">
		<Jour number="1" >
			<Task time="7">TDD01</Task>
		</Jour>
		<Jour number="2">
			<Task time="3">GB01</Task>
			<Task time="4">TDD01</Task>
		</Jour>
		<Jour number="3">
       		<Task time="3">GB01</Task>
			<Task time="4">CA20</Task>
		</Jour>
		<Jour number="4">
			<Task time="7">LIBRE</Task>
		</Jour>
		<Jour number="5">
			<Task time="7">INS PRO</Task>
		</Jour>
	</Semaine -->
	<Semaine number="47">
		<Jour number="1" >
			<Task time="3">GB01</Task>
			<Task time="2">Village By CA</Task>
			<Task time="2">TDD01</Task>
		</Jour>
		<Jour number="2">
			<Task time="3">TDD01</Task>
			<Task time="4">CODING DOJO</Task>
		</Jour>
		<Jour number="3">
       		<Task time="1">BDD02</Task>
			<Task time="6">CA20</Task>
		</Jour>
		<Jour number="4">
			<Task time="7">CA20</Task>
		</Jour>
		<Jour number="5">
			<Task time="3">INS PRO</Task>
			<Task time="1">Laurent SELLIN</Task>
			<Task time="3">INS PRO</Task>
		</Jour>
	</Semaine>
	<Semaine number="48">
		<Jour number="1"><Task time="7"> </Task></Jour>
		<Jour number="2"><Task time="7"> </Task></Jour>
		<Jour number="3"><Task time="7"> </Task></Jour>
		<Jour number="4"><Task time="7">CERT04.1</Task></Jour>
		<Jour number="5">
			<Task time="3">INS PRO </Task>
			<Task time="1">EUDES ELIE </Task>
			<Task time="3">INS PRO </Task>
		</Jour>
	</Semaine>
</Planning>
