<?xml version = "1.0" encoding="UTF-8" ?>
<!DOCTYPE root
  SYSTEM 'programmePedago.dtd'>
<root>
	<Programme formation="Referent Numerique">
		<Module group="Referent_Numerique" language="PHP">
			<Objectif>TODO</Objectif>
			<Sequence>
				<Objectif>TODO</Objectif>
				<Activite>
					<Objectif>Initiation Ã  la gestion de projet</Objectif>
					<Code>WEB-RN01-01</Code>
					<Description>
[OpenClassroom - Gestion Projet - 6h](https://openclassrooms.com/courses/decouvrez-les-bases-de-la-gestion-de-projet)
[OpenClassroom - Cahier des charges - 8h](https://openclassrooms.com/courses/realisez-le-cahier-des-charges-d-un-projet-digital)
					</Description>
				</Activite>
				<Activite>
					<Objectif>Mise en pratique de la gestion de projet</Objectif>
					<Code>WEB-RN01-02</Code>
					<Description>
						https://github.com/simplon-erwann-duclos/fork/blob/master/ChargeProjetNumerique.md
					</Description>
				</Activite>
			</Sequence>
		</Module>
	</Programme>
</root>