<?xml version = "1.0" encoding="UTF-8" ?>
<!DOCTYPE Planning  SYSTEM 'programmePedago.dtd'>
<Planning >
	<Semaine number="31">
		<Jour number="1" ferie="true"><Task time="7">Work@Home</Task></Jour>
		<Jour number="2" ferie="true"><Task time="7">Work@Home</Task></Jour>
		<Jour number="3" ferie="true"><Task time="7">Work@Home</Task></Jour>
		<Jour number="4" ferie="true"><Task time="7">Work@Home</Task></Jour>
		<Jour number="5" ferie="true"><Task time="7">Work@Home</Task></Jour>
	</Semaine>
	<Semaine number="32">
		<Jour number="1" ferie="true"><Task time="7">Work@Home</Task></Jour>
		<Jour number="2" ferie="true"><Task time="7">Work@Home</Task></Jour>
		<Jour number="3" ferie="true"><Task time="7">Work@Home</Task></Jour>
		<Jour number="4" ferie="true"><Task time="7">Work@Home</Task></Jour>
		<Jour number="5" ferie="true"><Task time="7">Work@Home</Task></Jour>
	</Semaine>
	<Semaine number="33">
		<Jour number="1" ferie="true"><Task time="7">Work@Home</Task></Jour>
		<Jour number="2" ferie="true"><Task time="7">FERIE</Task></Jour>
		<Jour number="3">
			<Task time="1">CUL04</Task>
			<Task time="6">JS12</Task>
		</Jour>
		<Jour number="4">
			<Task time="6">WP99</Task>
			<Task time="1">CUL15</Task>
		</Jour>
		<Jour number="5"><Task time="7">INS PRO</Task></Jour>
	</Semaine>
	<Semaine number="34">
		<Jour number="1" >
			<Task time="3">CERT01</Task></Jour>
			<Task time="4"></Task></Jour>
		<Jour number="2">
			<Task time="1">VEIL01</Task>
			<Task time="6"></Task>
		</Jour>
		<Jour number="3">
			<Task time="2">CERT01</Task>
			<Task time="5"></Task>
		</Jour>
		<Jour number="4"><Task time="7"></Task></Jour>
		<Jour number="5"><Task time="7">INS PRO</Task></Jour>
	</Semaine>
	<Semaine number="35">
		<Jour number="1" ><Task time="7"></Task></Jour>
		<Jour number="2">
			<Task time="1">VEIL01</Task>
			<Task time="6"></Task>
		</Jour>
		<Jour number="3"><Task time="7"></Task></Jour>
		<Jour number="4"><Task time="7"></Task></Jour>
		<Jour number="5"><Task time="7">INS PRO</Task></Jour>
	</Semaine>
	<!--Semaine number="28">
		<Jour number="1">
			<Task time="4">JS11</Task>
			<Task time="3">JS11</Task>
		</Jour>
		<Jour number="2">
			<Task time="4">JS11</Task>
			<Task time="2">Intervention Antoine et Tyjow</Task>
			<Task time="1">Intervention Annaelle</Task>
			
		</Jour>
		<Jour number="3">
			<Task time="3">PROJ</Task>
			<Task time="4">JS99</Task>
			
		</Jour>
		<Jour number="4" ferie="true"><Task time="7"></Task></Jour>
		<Jour number="5" ferie="true"><Task time="7"></Task></Jour>
	</Semaine>
	<Semaine number="29">
		<Jour number="1">
			<Task time="3">PROJ</Task>
			<Task time="3">JS11</Task>
			<Task time="1">CUL00</Task>
		</Jour>
		<Jour number="2">
			<Task time="3">PROJ</Task>
			<Task time="3">JS11</Task>
			<Task time="1">Intervention Portage Salarial</Task>
		</Jour>
		<Jour number="3">
			<Task time="3">PROJ</Task>
			<Task time="1">POO01</Task>
			<Task time="2">JS20</Task>
			<Task time="1">JS99</Task>
		</Jour>
		<Jour number="4" ferie="true"> 
			<Task time="7">INS PRO</Task>
		</Jour>
		<Jour number="5">
			<Task time="3">PROJ</Task>
			<Task time="4">JS21</Task>
		</Jour>
	</Semaine>
	<Semaine number="30">
		<Jour number="1">
			<Task time="3">JS21</Task>
			<Task time="4">PROJ</Task>
		</Jour>
		<Jour number="2">
			<Task time="3">JS21</Task>
			<Task time="4">JS21</Task>
		</Jour>
		<Jour number="3">
			<Task time="6">JS21</Task>
			<Task time="1">JS99</Task>
		</Jour>
		<Jour number="4" ferie="true">
			<Task time="7">INS PRO</Task>
		</Jour>
		<Jour number="5">
			<Task time="3">PROJ</Task>
			<Task time="2">PROJ</Task>
			<Task time="1">CUL00</Task>
			<Task time="1">PHP00</Task>	
		</Jour>
	</Semaine>
	<Semaine number="31">
		<Jour number="1">
			<Task time="3">PROJ</Task>
			<Task time="3">CMS01</Task>
			<Task time="1">GES01</Task>
		</Jour>
		<Jour number="2">
			<Task time="6">CMS01</Task>
			<Task time="1">CUL00</Task> juliette et abdul
		</Jour>
		<Jour number="3">
			<Task time="6">CMS01</Task>
			<Task time="1">CUL00</Task> ghaffar
		</Jour>
		<Jour number="4" ferie="true"><Task time="7">INS PRO</Task></Jour>
		<Jour number="5">
			<Task time="6">CMS01</Task>
			<Task time="1">CUL00</Task>
		</Jour>
	</Semaine-->
</Planning>
