<?xml version = "1.0" encoding="UTF-8" ?>
<!DOCTYPE Planning  SYSTEM 'programmePedago.dtd'>
<Planning >
	<Semaine number="39">
		<Jour number="1">
			<Task time="7">WEB-PHP-06</Task>
		</Jour>
		<Jour number="2">
			<Task time="7">WEB-PHP-06</Task>
		</Jour>
		<Jour number="3">
			<Task time="7">GES-04-01</Task>
		</Jour>
		<Jour number="4" ferie="true"><Task time="7">INS PRO</Task></Jour>
		<Jour number="5">
				<Task time="7">GES-04-01</Task>
		</Jour>
	</Semaine>
	<Semaine number="40">
		<Jour number="1">
			<Task time="7">WEB-PHP-07</Task>
		</Jour>
		<Jour number="2">
			<Task time="7">WEB-PHP-07</Task>
		</Jour>
		<Jour number="3">
			<Task time="7">WEB-PHP-07</Task>
		</Jour>
		<Jour number="4" ferie="true"><Task time="7">INS PRO</Task></Jour>
		<Jour number="5">
			<Task time="7">WEB-PHP-07</Task>
		</Jour>
	</Semaine>

</Planning>