<?xml version = "1.0" encoding="UTF-8" ?>
<!DOCTYPE Planning  SYSTEM 'programmePedago.dtd'>
<?xml-stylesheet href="styleProgrammePedago.css" type="text/css" ?>
<Planning >
	<Semaine number="23">
		<Jour number="1" ferie="true"><Task time="7">Feri√©</Task></Jour>
		<Jour number="2">
			<Task time="1">SOC05</Task>
			<Task time="1">SOC04</Task>
			<Task time="2">SOC03</Task>
			<Task time="1">SOC06</Task>
			<Task time="1">SOC07</Task>
			<Task time="1">CUL00</Task>
		</Jour>
		<Jour number="3">
			<Task time="4">SCRUM01</Task>
			<Task time="3"></Task>
		</Jour>
		<Jour number="4"><Task time="7"></Task></Jour>
		<Jour number="5"><Task time="7">INS PRO</Task></Jour>
	</Semaine>
	<Semaine number="24">
		<Jour number="1" ><Task time="7"></Task></Jour>
		<Jour number="2">
			<Task time="1">CUL02</Task>
		</Jour>
		<Jour number="3"><Task time="7"></Task></Jour>
		<Jour number="4"><Task time="7"></Task></Jour>
		<Jour number="5"><Task time="7">INS PRO</Task></Jour>
	</Semaine>
	<Semaine number="25">
		<Jour number="1" ><Task time="7"></Task></Jour>
		<Jour number="2">
			<Task time="1">CUL03</Task>
		</Jour>
		<Jour number="3"><Task time="7"></Task></Jour>
		<Jour number="4"><Task time="7"></Task></Jour>
		<Jour number="5"><Task time="7">INS PRO</Task></Jour>
	</Semaine>
	<Semaine number="26">
		<Jour number="1" ><Task time="7"></Task></Jour>
		<Jour number="2"><Task time="7"></Task></Jour>
		<Jour number="3"><Task time="7"></Task></Jour>
		<Jour number="4"><Task time="7"></Task></Jour>
		<Jour number="5"><Task time="7">INS PRO</Task></Jour>
	</Semaine>
	
</Planning>
