<?xml version = "1.0" encoding="UTF-8" ?>
<!DOCTYPE root
  SYSTEM 'programmePedago.dtd'>
<root>
	<Programme formation="Front End">
		<Module group="Front_End" language="PHP">
			<Objectif>Développer dans des langages web</Objectif>
			<Sequence>
				<Objectif>Développer un site web via AngularJS</Objectif>
				<Activite>
					<Objectif>Initiation à AngularJS</Objectif>
					<Code>WEB-FE-AngularJS-01</Code>
					<Description>

[Open Classroom - POO - 20h](https://openclassrooms.com/courses/apprenez-a-coder-avec-javascript/creez-vos-premiers-objets)
[Grafikart - POO - 25min](https://www.grafikart.fr/tutoriels/javascript/poo-javascript-object-466)
 
[Open Classroom - 10h](https://openclassrooms.com/courses/developpez-vos-applications-web-avec-angularjs)
[grafikart- 3h26 de videos](https://www.grafikart.fr/formations/angularjs)
Simplonline - 1e semaine](http://simplonline.co/les-parcours/game-of-codes/207-semaine-12-game-of-codes)
[Simplonline - 2e semaine](http://simplonline.co/les-parcours/game-of-codes/249-semaine-13-game-of-codes)
[Lauterry - ?](http://lauterry.github.io/slides-handson-angular)

					</Description>
				</Activite>
				<Activite>
					<Objectif>Mise en pratique de AngularJS</Objectif>
					<Code>WEB-FE-AngularJS-02</Code>
					<Description>
						https://github.com/simplon-erwann-duclos/fork/blob/master/FrontEnd.md
					</Description>
				</Activite>
			</Sequence>
		</Module>
		<Module>
			<Objectif>Pratiquer avec aisance l'algorithmie</Objectif>
			<Sequence>
				<Objectif>Approfondir l'algorithmie</Objectif>
				<Activite>
					<Objectif>Approfondir l'algorithmie sur Coding Game</Objectif>
					<Code>WEB-COD-01</Code>
					<Description>
						En pair programming, réalisez un exercice de coding game. En utilisant le language JavaScript.
					</Description>
				</Activite>
			</Sequence>
		</Module>
	</Programme>
</root>